{
  "$schema": "https://json-schema.org/draft/2020-12/schema",
  "type": "object",
  "required": ["id", "base", "keys", "defaults", "byKey"],
  "properties": {
    "id": { "type": "string" },
    "base": { "type": "string" },
    "keys": { "type": "array", "items": { "type": "string" } },
    "defaults": { "type": "object", "additionalProperties": { "type": "string" } },
    "byKey": {
      "type": "object",
      "additionalProperties": {
        "type": "object",
        "additionalProperties": { "type": "string" }
      }
    },
    "meta": {
      "type": "object",
      "additionalProperties": { "type": "string" }
    }
  }
}
