{
  "$schema": "../../schemas/variant.schema.json",
  "id": "components.alert",
  "base": "rounded-lg border px-4 py-3 shadow-sm outline-none ring-offset-background gap-6",
  "keys": ["variant"],
  "defaults": {
    "variant": ""
  },
  "byKey": {
    "variant": {
      "": "bg-card text-card-foreground",
      "default": "bg-card text-card-foreground",
      "destructive": "border-destructive bg-destructive/10 text-destructive",
      "success": "border-primary bg-primary/10 text-primary",
      "warning": "border-border bg-accent text-accent-foreground"
    }
  }
}
