{
  "$schema": "../../schemas/variants.schema.json",
  "base": "inline-flex items-center rounded-full border px-2.5 py-0.5 text-xs font-semibold transition-colors focus:outline-none focus:ring-2 focus:ring-ring focus:ring-offset-2",
  "byKey": {
    "size": {
      "default": "px-2.5 py-0.5 text-xs",
      "lg": "px-3 py-1 text-sm",
      "sm": "px-2 py-0.5 text-xs"
    },
    "variant": {
      "default": "border-transparent bg-primary text-primary-foreground hover:bg-primary/80",
      "destructive": "border-transparent bg-destructive text-destructive-foreground hover:bg-destructive/80",
      "outline": "text-foreground",
      "secondary": "border-transparent bg-secondary text-secondary-foreground hover:bg-secondary/80"
    }
  },
  "defaults": {
    "size": "default",
    "variant": "default"
  },
  "id": "ui.badge",
  "keys": [
    "variant",
    "size"
  ]
}
