{
  "$schema": "../../schemas/variants.schema.json",
  "base": "text-sm font-medium",
  "byKey": {
    "size": {
      "default": "text-sm",
      "lg": "text-base",
      "sm": "text-xs"
    },
    "variant": {
      "default": "",
      "muted": "text-muted-foreground",
      "unstyled": ""
    }
  },
  "defaults": {
    "size": "default",
    "variant": "default"
  },
  "id": "ui.form.legend",
  "keys": [
    "variant",
    "size"
  ]
}
